{
  "base_generation_id": null,
  "core_api_version": "1.2.0",
  "created_at": "2026-08-26T00:00:00Z",
  "created_reason": "fixture",
  "generation_id": "generation-1",
  "health_result_asset_id": "asset-health-1",
  "members": [],
  "parent_generation_id": null,
  "schema": "plugin-generation/v1"
}
